{
  "schema_version": "1.0.0",
  "migration_id": "MIG-20261024T102604Z-95393eae",
  "kind": "update",
  "from_version": "1.5.0",
  "to_version": "1.5.0",
  "created_at": "2026-10-24T10:26:04.015863Z",
  "applied_at": "2026-10-24T10:26:04.468822Z",
  "owner": "saturnine-spheres",
  "package": {
    "source": "C:\\Users\\ville\\saturnine-spheres\\general-prompts",
    "distribution_digest": "sha256:e3ff9857b57e372f314ff365d8d40a0d667c366228c9ce4208ea553a3dd94f1f"
  },
  "snapshot_dir": ".assurance/backups/MIG-20261024T102604Z-95393eae",
  "status": "applied",
  "rolls_back": null,
  "actions": [
    {
      "path": "AGENTS.md",
      "ownership": "merge-managed",
      "action": "SKIP",
      "before_digest": "sha256:0896cbde29591b830ffec5af4b5eea92f837b5c72d1629fb2015260c675bc034",
      "after_digest": "sha256:0896cbde29591b830ffec5af4b5eea92f837b5c72d1629fb2015260c675bc034",
      "upstream_digest": "sha256:0896cbde29591b830ffec5af4b5eea92f837b5c72d1629fb2015260c675bc034"
    },
    {
      "path": ".assurance/README.md",
      "ownership": "merge-managed",
      "action": "SKIP",
      "before_digest": "sha256:4a6e74058a5fff23b26e088fc52417f93bed6447ec5c35433a1237b71bf88cad",
      "after_digest": "sha256:4a6e74058a5fff23b26e088fc52417f93bed6447ec5c35433a1237b71bf88cad",
      "upstream_digest": "sha256:4a6e74058a5fff23b26e088fc52417f93bed6447ec5c35433a1237b71bf88cad"
    },
    {
      "path": ".assurance/project-assurance-profile.json",
      "ownership": "project-owned",
      "action": "SKIP",
      "before_digest": "sha256:30e210ebd8b0c402c3d0b6353a7d4f910a89e3a1ccb2860965fb423d73d354b3",
      "after_digest": "sha256:30e210ebd8b0c402c3d0b6353a7d4f910a89e3a1ccb2860965fb423d73d354b3",
      "upstream_digest": "sha256:fdb65fd99d90923306dca426db78daefe10d7224bbf47b45b6eb5cd553e4aeb8"
    },
    {
      "path": ".assurance/process.json",
      "ownership": "project-owned",
      "action": "SUGGEST",
      "before_digest": "sha256:07d399d40331fa0d84ed2eba5bc3f9e93d3f059e31de45552b08eb7b9e1cdaf7",
      "after_digest": "sha256:07d399d40331fa0d84ed2eba5bc3f9e93d3f059e31de45552b08eb7b9e1cdaf7",
      "upstream_digest": "sha256:4e1ebdc4dfb67596e7b8ca60e62c7adf0820df161f525224b8866c7e5c7b6f59"
    },
    {
      "path": ".assurance/control-catalog.yaml",
      "ownership": "merge-managed",
      "action": "SKIP",
      "before_digest": "sha256:db5dca08fc879796558d957bea207b0a66e16be4386cb9dafed1c68a35dccfa7",
      "after_digest": "sha256:db5dca08fc879796558d957bea207b0a66e16be4386cb9dafed1c68a35dccfa7",
      "upstream_digest": "sha256:db5dca08fc879796558d957bea207b0a66e16be4386cb9dafed1c68a35dccfa7"
    },
    {
      "path": ".assurance/change-class-evidence-matrix.json",
      "ownership": "merge-managed",
      "action": "SKIP",
      "before_digest": "sha256:7bc66810900dca9246095aeec8cd60902f5784ab078ca992abef610dd74f47af",
      "after_digest": "sha256:7bc66810900dca9246095aeec8cd60902f5784ab078ca992abef610dd74f47af",
      "upstream_digest": "sha256:7bc66810900dca9246095aeec8cd60902f5784ab078ca992abef610dd74f47af"
    },
    {
      "path": ".assurance/generalized-development-assurance-guidelines.md",
      "ownership": "merge-managed",
      "action": "SKIP",
      "before_digest": "sha256:594a1a0573478dc67246b0f1501175703e12eceadb02db6daaf64bb6e69ccb3f",
      "after_digest": "sha256:594a1a0573478dc67246b0f1501175703e12eceadb02db6daaf64bb6e69ccb3f",
      "upstream_digest": "sha256:594a1a0573478dc67246b0f1501175703e12eceadb02db6daaf64bb6e69ccb3f"
    },
    {
      "path": ".assurance/tiered-verifier-contract.md",
      "ownership": "merge-managed",
      "action": "SKIP",
      "before_digest": "sha256:ee12ce58c901646fcb455fbd49d2db5f25dc789e9b0301872ac47a506a70ca73",
      "after_digest": "sha256:ee12ce58c901646fcb455fbd49d2db5f25dc789e9b0301872ac47a506a70ca73",
      "upstream_digest": "sha256:ee12ce58c901646fcb455fbd49d2db5f25dc789e9b0301872ac47a506a70ca73"
    },
    {
      "path": ".assurance/glossary.md",
      "ownership": "merge-managed",
      "action": "SKIP",
      "before_digest": "sha256:a7d0ef687344ecd4f33c2c19b3a9ab09bc934c030810aaa0a17e42e71a38504c",
      "after_digest": "sha256:a7d0ef687344ecd4f33c2c19b3a9ab09bc934c030810aaa0a17e42e71a38504c",
      "upstream_digest": "sha256:a7d0ef687344ecd4f33c2c19b3a9ab09bc934c030810aaa0a17e42e71a38504c"
    },
    {
      "path": ".assurance/installation-and-update-guide.md",
      "ownership": "merge-managed",
      "action": "REPLACE",
      "before_digest": "sha256:fa7aa743434209dc805e1dbb9dca1b62a7458dac1a6336dff9577d9ec1448a91",
      "after_digest": "sha256:425ff8fb4955bf9255baa922377aa935ede9e09f068747dfe62b4ae86a4cbbf4",
      "upstream_digest": "sha256:425ff8fb4955bf9255baa922377aa935ede9e09f068747dfe62b4ae86a4cbbf4"
    },
    {
      "path": ".assurance/schemas/project-assurance-profile.schema.json",
      "ownership": "upstream-managed",
      "action": "SKIP",
      "before_digest": "sha256:692942e24affc13e6841da78abeb4df85a300b9376b046b14f8221c7a25409f5",
      "after_digest": "sha256:692942e24affc13e6841da78abeb4df85a300b9376b046b14f8221c7a25409f5",
      "upstream_digest": "sha256:692942e24affc13e6841da78abeb4df85a300b9376b046b14f8221c7a25409f5"
    },
    {
      "path": ".assurance/schemas/control-catalog.schema.json",
      "ownership": "upstream-managed",
      "action": "SKIP",
      "before_digest": "sha256:6944198a931ecd59b5db189f9865168e7c8ac1262e9b4c7bf9c9bff4f2bcc7d9",
      "after_digest": "sha256:6944198a931ecd59b5db189f9865168e7c8ac1262e9b4c7bf9c9bff4f2bcc7d9",
      "upstream_digest": "sha256:6944198a931ecd59b5db189f9865168e7c8ac1262e9b4c7bf9c9bff4f2bcc7d9"
    },
    {
      "path": ".assurance/schemas/change-class-evidence-matrix.schema.json",
      "ownership": "upstream-managed",
      "action": "SKIP",
      "before_digest": "sha256:bd4df114209eba93cc752d53bb3b0a526cbc5fb64e6da85ce480ec045c3714ed",
      "after_digest": "sha256:bd4df114209eba93cc752d53bb3b0a526cbc5fb64e6da85ce480ec045c3714ed",
      "upstream_digest": "sha256:bd4df114209eba93cc752d53bb3b0a526cbc5fb64e6da85ce480ec045c3714ed"
    },
    {
      "path": ".assurance/schemas/review-record.schema.json",
      "ownership": "upstream-managed",
      "action": "SKIP",
      "before_digest": "sha256:d8e1b2ca3ac2dceb310a01a82cc57b46874ca42ad51ac0adc827099170e9f73f",
      "after_digest": "sha256:d8e1b2ca3ac2dceb310a01a82cc57b46874ca42ad51ac0adc827099170e9f73f",
      "upstream_digest": "sha256:d8e1b2ca3ac2dceb310a01a82cc57b46874ca42ad51ac0adc827099170e9f73f"
    },
    {
      "path": ".assurance/schemas/verification-result.schema.json",
      "ownership": "upstream-managed",
      "action": "REPLACE",
      "before_digest": "sha256:cc514be26d741d1030595cee94779b7af6659e287e17824dce63ec6e66dcbb72",
      "after_digest": "sha256:a7ed21f4d9b3950313d9c2aad81effa848903ec0d5ae31fb4cc0eeab5e6a69f8",
      "upstream_digest": "sha256:a7ed21f4d9b3950313d9c2aad81effa848903ec0d5ae31fb4cc0eeab5e6a69f8"
    },
    {
      "path": ".assurance/schemas/waiver.schema.json",
      "ownership": "upstream-managed",
      "action": "SKIP",
      "before_digest": "sha256:121779bee2d9b368171077025bbdfb65a0a31686e3d1c6bb2b17709809be2935",
      "after_digest": "sha256:121779bee2d9b368171077025bbdfb65a0a31686e3d1c6bb2b17709809be2935",
      "upstream_digest": "sha256:121779bee2d9b368171077025bbdfb65a0a31686e3d1c6bb2b17709809be2935"
    },
    {
      "path": ".assurance/schemas/agent-effect-manifest.schema.json",
      "ownership": "upstream-managed",
      "action": "SKIP",
      "before_digest": "sha256:cc926ac2909f1fb465b6dd37c27410311f2a5e6ec7e4a333c965359231097422",
      "after_digest": "sha256:cc926ac2909f1fb465b6dd37c27410311f2a5e6ec7e4a333c965359231097422",
      "upstream_digest": "sha256:cc926ac2909f1fb465b6dd37c27410311f2a5e6ec7e4a333c965359231097422"
    },
    {
      "path": ".assurance/schemas/assurance-system-manifest.schema.json",
      "ownership": "upstream-managed",
      "action": "SKIP",
      "before_digest": "sha256:ca933c7ca352005bc8427495b03e59c870aed207de7ef652eda7eb043561223e",
      "after_digest": "sha256:ca933c7ca352005bc8427495b03e59c870aed207de7ef652eda7eb043561223e",
      "upstream_digest": "sha256:ca933c7ca352005bc8427495b03e59c870aed207de7ef652eda7eb043561223e"
    },
    {
      "path": ".assurance/schemas/run-manifest.schema.json",
      "ownership": "upstream-managed",
      "action": "REPLACE",
      "before_digest": "sha256:7e95aa515ee8d39e113184b9354c86b59c6566fcca6de1db6248f1b7a2a9b582",
      "after_digest": "sha256:7fdff092aa4e9a4c005acd44ad220b3837bd56ddb2aa5c9e57d5d42be7f77f5d",
      "upstream_digest": "sha256:7fdff092aa4e9a4c005acd44ad220b3837bd56ddb2aa5c9e57d5d42be7f77f5d"
    },
    {
      "path": ".assurance/schemas/process-contract.schema.json",
      "ownership": "upstream-managed",
      "action": "SKIP",
      "before_digest": "sha256:d35dfa322dab35e6ad9fab5e1518cdca9c580abfc0a4d57aee2eb2218a0f20b7",
      "after_digest": "sha256:d35dfa322dab35e6ad9fab5e1518cdca9c580abfc0a4d57aee2eb2218a0f20b7",
      "upstream_digest": "sha256:d35dfa322dab35e6ad9fab5e1518cdca9c580abfc0a4d57aee2eb2218a0f20b7"
    },
    {
      "path": ".assurance/schemas/verifier-config.schema.json",
      "ownership": "upstream-managed",
      "action": "SKIP",
      "before_digest": "sha256:3b8d0fb67619bf8279753bf8ba84e0192c941202de17c88c59698cbbbefa6408",
      "after_digest": "sha256:3b8d0fb67619bf8279753bf8ba84e0192c941202de17c88c59698cbbbefa6408",
      "upstream_digest": "sha256:3b8d0fb67619bf8279753bf8ba84e0192c941202de17c88c59698cbbbefa6408"
    },
    {
      "path": ".assurance/schemas/migration-record.schema.json",
      "ownership": "upstream-managed",
      "action": "REPLACE",